id,timestamp,decision,percentage,reason,btc_balance,krw_balance,btc_avg_buy_price,btc_krw_price,reflection
1,2025-01-09T05:21:15.578149,hold,0,"The current market sentiment is influenced by greed with a high Fear and Greed Index of 70, indicating potential bubble risks. Recent news headlines suggest volatility with price fluctuations and concerns over US data. The RSI indicates overselling at 45.75, and the order book shows higher selling pressure than buying pressure. Bollinger Bands suggest a channel for price drop potential, while MACD shows bearish signals. Given these indicators, a cautious approach is advised, aligning with Wonyyotti's method, emphasizing risk management and avoiding rash decisions. Thus, the decision is to hold.",0.0,6799052.03149397,0.0,141385000.0,"1. **Reflection**: Recent trading data is unavailable, making it challenging to analyze past decisions. However, the overall performance remained neutral at 0%, indicating conservative or precautionary trading or lack of activity.

2. **Insights**: Current market sentiment is labeled as ""Greed"" with a high Fear and Greed Index of 70. However, recent headlines suggest market volatility, especially with Bitcoin's significant price fluctuations. The news that nation-states and central banks may buy Bitcoin in 2025 could boost long-term investor confidence.

3. **Suggestions for Improvement**: Future trading strategies should consider the current ""Greed"" conditions as a potential bubble risk. It's vital to maintain risk management strategies, particularly during high volatility. Utilizing technical indicators like RSI and MACD might provide insights for entry and exit points, as Bitcoin shows signs of being oversold (RSI at 45.75) and recent bearish momentum.

4. **Patterns/Trends**: The order book reveals a higher ask size than bid size, suggesting selling pressure. Bollinger Bands and RSI indicate potential overselling, while MACD shows decreased bullish momentum. Trading volumes appear to spike during certain hours, possibly reflecting institutional trading. Overall, the volatility and current sentiment point to cautious market behavior with opportunities for savvy traders to capitalize on temporary dips by timing trades meticulously."
2,2025-01-09T09:01:07.742002,hold,0,"The current market sentiment is 'Greed' with a Fear and Greed Index of 70, indicating potential for increased volatility. The order book shows a significant imbalance with a much larger ask size compared to bid size, suggesting selling pressure. Technical indicators such as RSI and MACD show neutral to slight bearish signals, with RSI around mid-range and MACD showing negative divergence. Recent news about institutional purchases implies potential future support, but the current decline and selling pressure override this optimism for now. Following Wonyyotti's method, it is wise to hold until further confirmation of market direction and significant support or resistance levels are reached.",0.0,6799052.03149397,0.0,142301000.0,"1. **Reflection**: Recent trading decisions have shown restraint, with a consistent \""hold\"" strategy resulting in a neutral performance over the last 7 days. This cautious approach might have been influenced by high market sentiment, classified as ""Greed"".

2. **Insights**: The decision to hold was prudent given the increased volatility and potential bubble conditions. However, opportunities to capitalize on temporary dips were missed, as reflected in the significant daily price swings. The focus on risk management aligns well with the uncertain market conditions.

3. **Suggestions for Improvement**: Although caution is necessary during periods of high greed, incorporating strategic, small-scale trades during market dips could enhance performance. Using technical indicators such as RSI and MACD selectively for timing these entries and exits might improve returns. Additionally, monitoring institutional activity through volume spikes can provide clues for more informed decisions.

4. **Patterns/Trends**: The market shows significant selling pressure, with the order book indicating larger total ask sizes. Technical indicators like the Bollinger Bands suggest a potential downward price trend. Despite being oversold, Bitcoin's RSI remains around mid-range, with slight bearish MACD signals. Recent news about possible large-scale Bitcoin acquisitions by institutions could indicate future price support despite current volatility."
3,2025-01-09T15:02:10.900071,hold,0,"The market is currently showing signs of potential overselling with the price near the lower Bollinger Band, indicating possible recovery but the potential for further decline exists. The RSI is oscillating around the low 40s, reflecting bearish sentiment without being highly oversold. The MACD reflects downward momentum. Fear and Greed Index at 69 indicates market greed, suggesting cautious trading. Recent news about MicroStrategy's buy and plans to sell seized Bitcoin adds to volatility. Following Wonyyotti's method, focusing on chart analysis and avoiding trading during uncertain conditions, a hold decision is recommended to assess clearer market direction.",0.0,6799052.03149397,0.0,141242000.0,"1. **Reflection**: Recent decisions to hold have resulted in neutral performance. The strategy adhered to a conservative approach, prioritizing risk management amid market greed and volatility.

2. **Insights**: The hold strategy aligned with current market conditions, avoiding potential pitfalls of high-volatility trading. However, this cautiousness missed opportunities during price dips. The focus on institutional activities and sell pressure guided decisions, highlighting their relevance in market analysis.

3. **Suggestions for Improvement**: Introducing strategic trades during observed dips might enhance gains. Utilizing RSI and MACD for pinpointing entry and exit opportunities could be beneficial. Monitoring order book imbalances for signs of pressure shifts and institutional volumes for future support signals is critical.

4. **Patterns/Trends**: Current market shows sell pressure easing, with a larger bid size in recent order data. ""Greed"" sentiment persists but slightly decreased (FGI from 70 to 69). Bollinger Bands suggest potential downward movement, and price remains around the lower band, indicating possible overselling. The RSI oscillates around 44-50, reflecting recent bearishness but not highly oversold levels. Institutional interests, such as MicroStrategy's buy, provide potential long-term support."
4,2025-01-09T21:01:05.095214,buy,20,"Current technical indicators, such as RSI and the MACD, suggest a potentially oversold condition, indicating a buying opportunity. The market has shown a downturn, with prices near the lower Bollinger Band, which suggests potential for rebounding. Despite recent negative sentiment and news, institutional buying observed through increased bid size indicates possible support. Utilizing Wonyyotti's strategy, a tactical buy during this bearish phase aligns with risk-managed entry points. Hence, allocating 20% of available KRW for buying is recommended.",0.00970922,5442683.17272205,140072000.0,140068000.0,"1. **Reflection**: Recent trading decisions maintained a neutral stance, with repeated ""hold"" positions. This approach emphasized caution amid high market greed and potential volatility, leading to stable but non-profitable outcomes over the past seven days.

2. **Insights**: The decision to hold was aligned with market conditions, effectively managing risk given the volatility and potential bubble risks indicated by a high Fear and Greed Index. However, the absence of active trading prevented capitalizing on short-term dips and potential rebounds, as indicated by lower Bollinger Band positioning and RSI fluctuations in the mid-40s.

3. **Suggestions for Improvement**: To enhance future trading strategies, consider small-scale tactical trades during market dips, guided by technical indicators like RSI for oversold conditions and MACD momentum shifts. Monitoring institutional activities and large order book imbalances can reveal pressure shifts and potential support levels, improving entry and exit timing.

4. **Patterns/Trends**: The market shows a consistent overselling tendency with price movements near the Bollinger Band lower bounds and an RSI stabilizing in the low 40s, suggesting persistent bearish pressure. Institutional buying during recent dips indicates possible long-term support, despite current volatility. The order book reflects an increasing bid size, suggesting easing sell pressure and potential market stabilization."
5,2025-01-10T05:21:09.641408,hold,0,"Current technical indicators like RSI and MACD suggest a continuation of bearish momentum. The market is showing high ask size relative to bid size, indicating strong selling pressure. Recent news also highlights negative aspects such as high ETF outflows and potential sales by the US government, despite some bullish sentiments from key investors. The Fear and Greed Index indicates greed, which can caution against impulsive buying. Following Wonyyotti's strategy, it's prudent to wait for further technical confirmations before making a move.",0.00970922,5442683.17272205,140072000.0,139179000.0,"1. **Reflection:** The recent decision to switch from a holding strategy to a tactical buy reflects an attempt to seize potential rebound opportunities highlighted by oversold indicators. This shift denotes a proactive response to technical signals, despite persistent bearish sentiment.

2. **Insights:** The cautious holding approach efficiently mitigated risks during high volatility but limited opportunities for profit during short-term market reversals. The tactical buy, supported by technical indicators and increased institutional interest, suggests effective use of market insights.

3. **Suggestions for Improvement:** To enhance future strategies, continue leveraging technical indicators like RSI and MACD for timing trades, especially during oversold conditions. Consider diversifying entry points with gradual buys to combat volatility. Monitoring large buy orders and bid sizes can provide additional support signals.

4. **Patterns/Trends:** The market exhibits persistent bearish pressure with dominant ask sizes over bid sizes, suggesting continued sell pressure. RSI levels hovering around low-to-mid 40s indicate oversold conditions, while MACD shows negative momentum. Institutional interest, such as recent acquisitions by MicroStrategy, could offer underlying support, yet significant institutional Bitcoin sales remain a risk. Despite a neutral performance, maintaining vigilance on sentiment shifts, such as changes in the Fear and Greed Index, is crucial."
6,2025-01-10T09:01:16.538110,hold,0,"1. **Technical Indicators**: The RSI is in the low 40s, indicating oversold conditions, but not extremely oversold, suggesting caution. MACD shows bearish signals, further highlighting ongoing downward momentum.

2. **Market Data**: The total ask size is significantly larger than the bid size, indicating continued selling pressure and bearish sentiment.

3. **Recent News**: Multiple news headlines are negative, suggesting potential selling pressure and volatility. 

4. **Fear and Greed Index**: The index is at 'Greed,' suggesting a high likelihood of irrational decisions and the need for caution.

5. **Chart Analysis**: The chart shows a downward trend. It’s important to wait for clearer support confirmation before making any purchasing decisions.

Therefore, the best course of action is to hold and wait for clearer signals to buy or sell, aligning with a careful strategy given current bearish conditions.",0.00970922,5442683.17272205,140072000.0,139787000.0,"1. **Reflection on Recent Trading Decisions:** The trading approach has been predominantly cautious, with multiple ""hold"" decisions reflecting an emphasis on risk management amidst high market greed and bearish technical indicators.

2. **Insights on What Worked Well and What Didn't:** The cautious strategy successfully minimized risk exposure during volatile periods. However, the reliance on ""hold"" decisions missed opportunities for gains amidst price dips and fleeting rebounds. The tactical buy utilized as a response to technical signals like an oversold RSI and institutional interest worked well in capturing short-term upside, but the subsequent high selling pressure limited its effectiveness.

3. **Suggestions for Improvement:** Future strategies should consider incorporating more tactical trades at strategic moments, guided by technical indicators such as RSI and MACD, especially during overselling conditions. A phased buying approach can mitigate risk while capturing potential rebounds. Monitoring institutional buying patterns and order book dynamics for entry cues is crucial. Adaptability and responsiveness to market shifts are key, potentially through automated triggers based on technical thresholds.

4. **Patterns or Trends in Market Data:** The market continues to exhibit significant selling pressure, with a higher total ask size than bid size, indicating ongoing bearish sentiment. Technical indicators like Bollinger Bands suggest the potential for downward movements, while RSI remains in the low 40s, highlighting overselling conditions. Despite ongoing bearish trends, increased institutional activity offers potential long-term support. The fear-greed index remains in 'Greed,' cautioning against impulsive decisions."
7,2025-01-10T15:01:10.565552,hold,0,"The market sentiment is neutral (Fear and Greed Index at 50), and the recent order book shows stronger bid pressure, suggesting interest in buying, but the MACD remains negative. The recent rise to the upper Bollinger Band may indicate potential resistance, and news headlines are mixed with some negative sentiment. Overall, caution is advisable; hence, holding is the appropriate decision for now.",0.00970922,5442683.17272205,140072000.0,141873000.0,"**Reflection on Recent Trading Decisions:** Recent decisions to ""hold"" were cautious, aligning with oversold indicators and bearish market sentiment, successfully mitigating risk during volatile periods. However, this approach resulted in missed opportunities during short-term rebounds.

**Insights:** The conservative strategy effectively minimized risk exposure, particularly during spikes in market greed and negative momentum as indicated by MACD and RSI. Despite these measures, the lack of engagement during brief price rises led to stagnant performance, highlighting a need for more agile trading tactics.

**Suggestions for Improvement:** Consider adopting a phased buying strategy during oversold conditions as indicated by RSI and MACD crossovers, potentially using partial allocations to tap into rebounds. Active monitoring of institutional buying patterns and order book dynamics could enhance timing and precision in executing trades. Utilize automated systems to trigger trades at predefined technical levels to capitalize on transient price movements.

**Market Patterns/Trends:** The market exhibits a neutral sentiment with the Fear and Greed Index at 50. A greater bid size over ask size suggests potential easing of selling pressure. RSI indicates recovering sentiment from oversold conditions, while MACD remains negative, highlighting caution. Recent price gains toward upper Bollinger Bands suggest potential resistance, necessitating careful monitoring for sustained upward movement or further corrections."
8,2025-01-10T21:01:10.015645,hold,0,"1. **Technical Indicators and Market Data**: The RSI is neutral at 48, and MACD shows negative signals indicating caution. The price is near the upper Bollinger Band, possibly encountering resistance.

2. **Market Sentiment**: The Fear and Greed Index is neutral at 50, suggesting neither strong buying nor selling pressure.

3. **Recent News**: Headlines reflect sell-off sentiments with warnings about price crashes and ETF outflows, which could contribute to volatility.

4. **Order Book Dynamics**: There is larger ask size relative to bid size, indicating selling pressure.

5. **Performance Reflection**: A cautious hold strategy previously contributed to modest gains, suggesting a continuation until clearer signals emerge.

Based on Wonyyotti's method, focusing on technical analysis and sentiment, there is no strong buying or selling signal presently.",0.00970922,5442683.17272205,140072000.0,142781000.0,"1. **Reflection on Recent Trading Decisions:** Recent trading decisions primarily involved holding, emphasizing risk management in a volatile and neutral sentiment market. This cautious approach contributed to a modest overall performance gain of 0.31% over the past week.

2. **Insights on What Worked Well and What Didn't:** The conservative strategy effectively protected against large losses during market uncertainty and negative signals from the MACD. However, the heavy reliance on holding positions led to missed opportunities during brief positive price movements, as indicated by the price reaching toward the upper Bollinger Band.

3. **Suggestions for Improvement:** To enhance future performance, consider implementing a phased buying strategy in oversold conditions, leveraging RSI or MACD crossovers. Employing automated trading systems to execute trades at predefined technical levels could optimize timing and capture transient price movements. Active monitoring of order book dynamics and institutional activity can provide more timely entry and exit cues.

4. **Patterns or Trends in Market Data:** The market shows a neutral sentiment per the Fear and Greed Index, with ongoing selling pressure as indicated by a larger ask size relative to bid size. Technical indicators suggest an improving RSI, currently at 48, while the negative MACD highlights caution. Price increases near the upper Bollinger Band may encounter resistance, indicating careful monitoring is needed for clear breakout or reversal."
9,2025-01-11T05:21:44.765266,hold,0,"The RSI is near neutral at 48, indicating no strong momentum in either direction. The recent MACD trend shows negative values, suggesting bearish sentiment. The Fear and Greed Index is neutral at 50, providing no clear sentiment direction. The price is approaching the upper Bollinger Band, indicating potential resistance. News of significant Bitcoin sales by the government could increase volatility, adding to uncertainty. Given these mixed signals, holding is a cautious approach to manage risk.",0.00970922,5442683.17272205,140072000.0,142921000.0,"1. **Reflection**: Recent trading decisions were predominantly cautious, leveraging a ""hold"" strategy amid neutral to bearish indicators. This cautious approach was effective for risk management, albeit at the potential cost of missed short-term opportunities during price fluctuations.

2. **Insights**: The hold strategy helped safeguard against larger losses during periods of high market volatility and mixed sentiment. However, it resulted in missed opportunities for quick gains during temporary rebounds when technical indicators like RSI signaled neutral levels conducive to buying actions. 

3. **Suggestions for Improvement**: To enhance future performance, consider integrating a phased buying strategy aligned with technical crossovers, such as MACD or RSI signals. Automating buy/sell triggers based on predefined technical levels might capitalize on fleeting market opportunities. Real-time monitoring of order book dynamics and institutional activities could also refine entry and exit timing.

4. **Market Patterns/Trends**: The current market exhibits neutral sentiment (Fear and Greed Index at 50) with slight selling pressure from larger ask sizes. RSI at 48 indicates a neutral stance, suggesting potential for upward movement if coupled with positive momentum. Recent news featuring governmental Bitcoin sales and ETF outflows could spur further volatility, underscoring the necessity for vigilant monitoring and responsive strategies. The price hovering near upper Bollinger Bands might encounter resistance, necessitating a wait-and-see approach for clearer breakout signals."
10,2025-01-11T09:01:19.971052,sell,50,"The current market sentiment is neutral as indicated by the Fear and Greed Index at 50. Recent headlines suggest mixed signals with warnings of a crash and predictions of a ripe buying period. Technical indicators show recent volatility with RSI oscillating near neutral and MACD showing bearish crossover signals.

The order book reveals stronger selling pressure with larger ask sizes compared to bid sizes. The chart image shows some recovery but with resistance near the upper Bollinger Band. Volatility and mixed sentiment suggest a cautious approach, and selling half of the current BTC holdings can manage risk while still leaving room for potential upside if conditions improve.",0.00485461,6133925.11945175,140072000.0,142540000.0,"1. **Reflection**: The recent trading strategy has been notably cautious, primarily focusing on a 'hold' approach amid neutral and bearish signals. This careful positioning has largely protected against substantial losses, contributing to a modest overall performance gain of 0.46%.

2. **Insights**: The hold approach effectively managed risk during uncertain conditions, particularly amidst mixed sentiment and technical indicators like RSI and MACD showing volatility. However, this strategy missed potential short-term gains during temporary rebounds when technical indicators temporarily favored buying.

3. **Suggestions for Improvement**: Implement a more agile approach by integrating phased buying or selling strategies during clear oversold or overbought conditions. Leverage automated systems to capitalize on fleeting market opportunities identified by technical crossovers or significant shifts in order book dynamics. Monitoring institutional activities could enhance timing for trades.

4. **Market Patterns/Trends**: Current market conditions suggest neutrality with the Fear and Greed Index at 50. There's a persistent pattern of larger ask sizes indicating selling pressure in the order book. The RSI is oscillating near neutral, hinting at indecisive market momentum. Recent news headlines and technical indicators signal potential for increased volatility, necessitating vigilance and adaptability in trading strategies. This environment suggests opportunities might emerge from closely monitoring resistance points near upper Bollinger Bands and order book shifts."
11,2025-01-11T15:01:10.453754,sell,50,"The technical indicators show a slightly bearish outlook with RSI near 46 and MACD in a negative crossover. The Fear and Greed Index is at 69, indicating 'Greed', which could precede increased volatility. There is significant selling pressure indicated by larger ask sizes compared to bid sizes in the order book. Recent news is predominantly negative, including potential government sales of seized Bitcoin and warnings against buying the dip. Considering these factors and reflecting on the 'Wonyyotti' method which emphasizes chart analysis and risk management, selling a portion of holdings is prudent to manage potential downside risk.",0.00242731,6478499.7376559,140072000.0,142029000.0,"1. **Reflection**: Recent trading decisions have been cautious, predominantly involving holding positions amidst mixed signals. This approach yielded a modest gain of 0.39%, effectively managing risk during volatile and uncertain market conditions.

2. **Insights**: The cautious stance protected against potential losses amid high selling pressure and bearish technical indicators, such as negative MACD and neutral RSI levels. However, this conservative strategy resulted in missed opportunities during brief rebounds, reflecting a lack of agility.

3. **Suggestions for Improvement**: Future strategies should integrate more agile responses, such as phased buying or selling during clear oversold/overbought conditions. Automating trade executions based on technical indicators like RSI and MACD could capture transient opportunities. Real-time monitoring of order book dynamics and institutional activities might refine entry and exit timings.

4. **Market Patterns/Trends**: Current data indicates a persistent selling pressure with larger ask sizes, suggesting bearish sentiment. The Fear and Greed Index is at 69, indicating ""Greed,"" which could precede increased volatility. Technical indicators portray a neutral to slightly bearish outlook, with RSI near 46 and MACD signals under significant negative crossover. Monitoring these indicators closely can guide better-informed trading decisions, especially as the market approaches resistance levels around upper Bollinger Bands."
